[
  {
    "kind": "osdu:wks:work-product-component--WellLog:1.0.0",
    "acl": {
      "owners": [
        "data.default.owners@hugin.example.com"
      ],
      "viewers": [
        "data.default.viewers@hugin.example.com"
      ]
    },
    "legal": {
      "legaltags": [
        "hugin-placeholder-legal-tag"
      ],
      "otherRelevantDataCountries": [
        "NO"
      ],
      "status": "compliant"
    },
    "id": "hugin:work-product-component--WellLog:NO_15_9-F-15_B_KLOGH_NEW.las",
    "data": {
      "Name": "NO_15_9-F-15_B_KLOGH_NEW.las",
      "Source": "Equinor Volve open dataset, via HUGIN",
      "WellboreID": "hugin:master-data--Wellbore:15%2F9-F-15%20B",
      "TopMeasuredDepth": 3370.5759,
      "BottomMeasuredDepth": 3378.6531,
      "Curves": [
        {
          "Mnemonic": "KLOGH_NEW",
          "TopDepth": 3370.5759,
          "BaseDepth": 3378.6531,
          "DepthUnit": "namespace:reference-data--UnitOfMeasure:m:",
          "DepthCoding": "REGULAR",
          "ExtensionProperties": {
            "SentinelReadingCount": 0
          }
        }
      ],
      "ExtensionProperties": {
        "IndexMnemonic": "DEPTH",
        "SampleCount": 54
      }
    }
  },
  {
    "kind": "osdu:wks:work-product-component--WellLog:1.0.0",
    "acl": {
      "owners": [
        "data.default.owners@hugin.example.com"
      ],
      "viewers": [
        "data.default.viewers@hugin.example.com"
      ]
    },
    "legal": {
      "legaltags": [
        "hugin-placeholder-legal-tag"
      ],
      "otherRelevantDataCountries": [
        "NO"
      ],
      "status": "compliant"
    },
    "id": "hugin:work-product-component--WellLog:NO_15_9-F-15_A_KLOGH_NEW.las",
    "data": {
      "Name": "NO_15_9-F-15_A_KLOGH_NEW.las",
      "Source": "Equinor Volve open dataset, via HUGIN",
      "WellboreID": "hugin:master-data--Wellbore:15%2F9-F-15%20A",
      "TopMeasuredDepth": 3799.5774,
      "BottomMeasuredDepth": 3896.8085,
      "Curves": [
        {
          "Mnemonic": "KLOGH_NEW",
          "TopDepth": 3799.5774,
          "BaseDepth": 3896.8085,
          "DepthUnit": "namespace:reference-data--UnitOfMeasure:m:",
          "DepthCoding": "REGULAR",
          "ExtensionProperties": {
            "SentinelReadingCount": 0
          }
        }
      ],
      "ExtensionProperties": {
        "IndexMnemonic": "DEPTH",
        "SampleCount": 639
      }
    }
  },
  {
    "kind": "osdu:wks:work-product-component--WellLog:1.0.0",
    "acl": {
      "owners": [
        "data.default.owners@hugin.example.com"
      ],
      "viewers": [
        "data.default.viewers@hugin.example.com"
      ]
    },
    "legal": {
      "legaltags": [
        "hugin-placeholder-legal-tag"
      ],
      "otherRelevantDataCountries": [
        "NO"
      ],
      "status": "compliant"
    },
    "id": "hugin:work-product-component--WellLog:FI090048b-2.las",
    "data": {
      "Name": "FI090048b-2.las",
      "Source": "Equinor Volve open dataset, via HUGIN",
      "WellboreID": "hugin:master-data--Wellbore:15%2F9-F-15%20S",
      "TopMeasuredDepth": 3939.0,
      "BottomMeasuredDepth": 4089.0,
      "Curves": [
        {
          "Mnemonic": "AMU1",
          "TopDepth": 3939.0,
          "BaseDepth": 4089.0,
          "DepthUnit": "namespace:reference-data--UnitOfMeasure:m:",
          "DepthCoding": "REGULAR",
          "ExtensionProperties": {
            "SentinelReadingCount": 0
          }
        },
        {
          "Mnemonic": "AMU10",
          "TopDepth": 3939.0,
          "BaseDepth": 4089.0,
          "DepthUnit": "namespace:reference-data--UnitOfMeasure:m:",
          "DepthCoding": "REGULAR",
          "ExtensionProperties": {
            "SentinelReadingCount": 0
          }
        },
        {
          "Mnemonic": "AMU100",
          "TopDepth": 3939.0,
          "BaseDepth": 4089.0,
          "DepthUnit": "namespace:reference-data--UnitOfMeasure:m:",
          "DepthCoding": "REGULAR",
          "ExtensionProperties": {
            "SentinelReadingCount": 0
          }
        },
        {
          "Mnemonic": "AMU101",
          "TopDepth": 3939.0,
          "BaseDepth": 4089.0,
          "DepthUnit": "namespace:reference-data--UnitOfMeasure:m:",
          "DepthCoding": "REGULAR",
          "ExtensionProperties": {
            "SentinelReadingCount": 0
          }
        },
        {
          "Mnemonic": "AMU102",
          "TopDepth": 3939.0,
          "BaseDepth": 4089.0,
          "DepthUnit": "namespace:reference-data--UnitOfMeasure:m:",
          "DepthCoding": "REGULAR",
          "ExtensionProperties": {
            "SentinelReadingCount": 0
          }
        },
        {
          "Mnemonic": "AMU103",
          "TopDepth": 3939.0,
          "BaseDepth": 4089.0,
          "DepthUnit": "namespace:reference-data--UnitOfMeasure:m:",
          "DepthCoding": "REGULAR",
          "ExtensionProperties": {
            "SentinelReadingCount": 0
          }
        },
        {
          "Mnemonic": "AMU104",
          "TopDepth": 3939.0,
          "BaseDepth": 4089.0,
          "DepthUnit": "namespace:reference-data--UnitOfMeasure:m:",
          "DepthCoding": "REGULAR",
          "ExtensionProperties": {
            "SentinelReadingCount": 0
          }
        },
        {
          "Mnemonic": "AMU105",
          "TopDepth": 3939.0,
          "BaseDepth": 4089.0,
          "DepthUnit": "namespace:reference-data--UnitOfMeasure:m:",
          "DepthCoding": "REGULAR",
          "ExtensionProperties": {
            "SentinelReadingCount": 0
          }
        },
        {
          "Mnemonic": "AMU106",
          "TopDepth": 3939.0,
          "BaseDepth": 4089.0,
          "DepthUnit": "namespace:reference-data--UnitOfMeasure:m:",
          "DepthCoding": "REGULAR",
          "ExtensionProperties": {
            "SentinelReadingCount": 0
          }
        },
        {
          "Mnemonic": "AMU107",
          "TopDepth": 3939.0,
          "BaseDepth": 4089.0,
          "DepthUnit": "namespace:reference-data--UnitOfMeasure:m:",
          "DepthCoding": "REGULAR",
          "ExtensionProperties": {
            "SentinelReadingCount": 0
          }
        },
        {
          "Mnemonic": "AMU108",
          "TopDepth": 3939.0,
          "BaseDepth": 4089.0,
          "DepthUnit": "namespace:reference-data--UnitOfMeasure:m:",
          "DepthCoding": "REGULAR",
          "ExtensionProperties": {
            "SentinelReadingCount": 0
          }
        },
        {
          "Mnemonic": "AMU109",
          "TopDepth": 3939.0,
          "BaseDepth": 4089.0,
          "DepthUnit": "namespace:reference-data--UnitOfMeasure:m:",
          "DepthCoding": "REGULAR",
          "ExtensionProperties": {
            "SentinelReadingCount": 0
          }
        },
        {
          "Mnemonic": "AMU11",
          "TopDepth": 3939.0,
          "BaseDepth": 4089.0,
          "DepthUnit": "namespace:reference-data--UnitOfMeasure:m:",
          "DepthCoding": "REGULAR",
          "ExtensionProperties": {
            "SentinelReadingCount": 0
          }
        },
        {
          "Mnemonic": "AMU110",
          "TopDepth": 3939.0,
          "BaseDepth": 4089.0,
          "DepthUnit": "namespace:reference-data--UnitOfMeasure:m:",
          "DepthCoding": "REGULAR",
          "ExtensionProperties": {
            "SentinelReadingCount": 0
          }
        },
        {
          "Mnemonic": "AMU111",
          "TopDepth": 3939.0,
          "BaseDepth": 4089.0,
          "DepthUnit": "namespace:reference-data--UnitOfMeasure:m:",
          "DepthCoding": "REGULAR",
          "ExtensionProperties": {
            "SentinelReadingCount": 0
          }
        },
        {
          "Mnemonic": "AMU112",
          "TopDepth": 3939.0,
          "BaseDepth": 4089.0,
          "DepthUnit": "namespace:reference-data--UnitOfMeasure:m:",
          "DepthCoding": "REGULAR",
          "ExtensionProperties": {
            "SentinelReadingCount": 0
          }
        },
        {
          "Mnemonic": "AMU113",
          "TopDepth": 3939.0,
          "BaseDepth": 4089.0,
          "DepthUnit": "namespace:reference-data--UnitOfMeasure:m:",
          "DepthCoding": "REGULAR",
          "ExtensionProperties": {
            "SentinelReadingCount": 0
          }
        },
        {
          "Mnemonic": "AMU114",
          "TopDepth": 3939.0,
          "BaseDepth": 4089.0,
          "DepthUnit": "namespace:reference-data--UnitOfMeasure:m:",
          "DepthCoding": "REGULAR",
          "ExtensionProperties": {
            "SentinelReadingCount": 0
          }
        },
        {
          "Mnemonic": "AMU115",
          "TopDepth": 3939.0,
          "BaseDepth": 4089.0,
          "DepthUnit": "namespace:reference-data--UnitOfMeasure:m:",
          "DepthCoding": "REGULAR",
          "ExtensionProperties": {
            "SentinelReadingCount": 0
          }
        },
        {
          "Mnemonic": "AMU116",
          "TopDepth": 3939.0,
          "BaseDepth": 4089.0,
          "DepthUnit": "namespace:reference-data--UnitOfMeasure:m:",
          "DepthCoding": "REGULAR",
          "ExtensionProperties": {
            "SentinelReadingCount": 0
          }
        },
        {
          "Mnemonic": "AMU117",
          "TopDepth": 3939.0,
          "BaseDepth": 4089.0,
          "DepthUnit": "namespace:reference-data--UnitOfMeasure:m:",
          "DepthCoding": "REGULAR",
          "ExtensionProperties": {
            "SentinelReadingCount": 0
          }
        },
        {
          "Mnemonic": "AMU118",
          "TopDepth": 3939.0,
          "BaseDepth": 4089.0,
          "DepthUnit": "namespace:reference-data--UnitOfMeasure:m:",
          "DepthCoding": "REGULAR",
          "ExtensionProperties": {
            "SentinelReadingCount": 0
          }
        },
        {
          "Mnemonic": "AMU119",
          "TopDepth": 3939.0,
          "BaseDepth": 4089.0,